{
  "actual_next_action": "KAI_WARNS_PRIVATELY",
  "canonical_memory_write": false,
  "episode_id": "sealedte-info-asym-14",
  "equivalent_formulation_checks": [
    {
      "check_id": "sealedte-info-asym-14-d-equivalent-action",
      "expected_top_action": "KAI_WARNS_PRIVATELY",
      "formulation_id": "same-question-paraphrase-001",
      "prediction_id": "sealedte-info-asym-14-d-prediction"
    }
  ],
  "factual_branch_id": "sealedte-info-asym-14-d-factual",
  "hidden_state_labels": {
    "sealedte-info-asym-14-d-tom1-factual": "TRUE",
    "sealedte-info-asym-14-d-tom2-factual": "TRUE"
  },
  "literal_history_branch_ids": [
    "sealedte-info-asym-14-d-factual"
  ],
  "outcome_id": "sealedte-info-asym-14-d-outcome",
  "outcome_visible": true,
  "prediction_id": "sealedte-info-asym-14-d-prediction",
  "reveal_complete": true,
  "revealed_at": "2026-07-21T04:13:02Z",
  "schema": "persona_dream.research.prospective_tom.tom_outcome_reveal.v1"
}
