{
  "actual_next_action": "KAI_INTERRUPTS_WITH_CORRECTION",
  "canonical_memory_write": false,
  "episode_id": "explicit-info-asym-06",
  "equivalent_formulation_checks": [
    {
      "check_id": "explicit-info-asym-06-cd-equivalent-action",
      "expected_top_action": "KAI_INTERRUPTS_WITH_CORRECTION",
      "formulation_id": "same-question-paraphrase-001",
      "prediction_id": "explicit-info-asym-06-cd-prediction"
    }
  ],
  "factual_branch_id": "explicit-info-asym-06-cd-factual",
  "hidden_state_labels": {
    "explicit-info-asym-06-cd-tom1-factual": "TRUE",
    "explicit-info-asym-06-cd-tom2-factual": "TRUE"
  },
  "literal_history_branch_ids": [
    "explicit-info-asym-06-cd-factual"
  ],
  "outcome_id": "explicit-info-asym-06-cd-outcome",
  "outcome_visible": true,
  "prediction_id": "explicit-info-asym-06-cd-prediction",
  "reveal_complete": true,
  "revealed_at": "2026-07-21T04:05:03Z",
  "schema": "persona_dream.research.prospective_tom.tom_outcome_reveal.v1"
}
