{
  "actual_next_action": "KAI_DELEGATES_TRUST",
  "canonical_memory_write": false,
  "episode_id": "sealedte-trust-commit-24",
  "equivalent_formulation_checks": [
    {
      "check_id": "live-tau-condition-cd-eq-action",
      "expected_top_action": "KAI_SETS_BOUNDARY",
      "formulation_id": "same-question-paraphrase-001",
      "prediction_id": "live-tau-cd-sealedte-trust-commit-24-prediction"
    }
  ],
  "factual_branch_id": "live-tau-cd-sealedte-trust-commit-24-factual",
  "hidden_state_labels": {
    "live-tau-cd-sealedte-trust-commit-24-tom1-factual": "TRUE",
    "live-tau-cd-sealedte-trust-commit-24-tom2-factual": "TRUE"
  },
  "literal_history_branch_ids": [
    "live-tau-cd-sealedte-trust-commit-24-factual"
  ],
  "outcome_id": "live-tau-condition-outcome-sealedte-trust-commit-24-cd",
  "outcome_visible": true,
  "prediction_id": "live-tau-cd-sealedte-trust-commit-24-prediction",
  "reveal_complete": true,
  "revealed_at": "2026-07-21T11:34:10Z",
  "schema": "persona_dream.research.prospective_tom.tom_outcome_reveal.v1"
}
